5168215,Chomhairligh an dochtúir leis gur fearr éirí as an deoch.,7869831,The doctor advised him that it would be better to give up the drink.
7870173,Caithfidh mé staidéar a dhéanamh,400129,I must study.
4555634,An bhfuil aithne agat ar a athair?,1532072,Do you know his father?
4555649,Tabharfaidh mé duit iad.,2547277,I'll get them for you.
4555648,Tabharfaidh mé duit é.,2878227,I'll get it for you.
3559831,Níl fhios agam.,349064,I don't know.
6319563,Tá sí ag sábháil airgid le dul thar lear.,58548,She is saving money to go abroad.
2936214,Is féidir leat féin sin a rá le Tom.,7871789,You can say that to Tom yourself.
7871804,Ní dheachaigh aon duine ar bith ansin.,874881,Nobody went there.
7908700,"Is oth liom nach bhfuil muid i Kansas a thuilleadh, a duirt Pól.",773136,"I'm afraid we're not in Kansas anymore, said Paul."
7804960,An bhfuil bron ort?,1755584,Are you sad?
7922339,Níl leigheas in aghaidh an bháis.,751769,Everyone must die.
7922339,Níl leigheas in aghaidh an bháis.,7922343,There is no cure for death.
557579,Táim i ngrá leat.,499751,I'm in love with you.
874856,Deirtear go mbíonn sé te anseo.,7924469,It's said to be hot here.
4773228,Caitheann sé éadaí dubha i gcónaí.,4773222,He always wears black clothes.
7912668,Táim go han-mhaith.,7822163,I'm very good.
7809349,Níl mé ábalta é sin a déanamh.,1650200,I can't do that.
5168002,Níl cead aici dul amach anois.,7924738,She is not allowed to go out now.
4646714,Bailigh leat amach as seo!,7924743,Go on away out of that!
7816272,An bhfuil aon duine anseo?,2248428,Is anyone here?
6319617,Tá mé folláin.,259288,I'm healthy.
4771893,Tá an taoiseach ag labhairt liom.,7924753,The taoiseach is talking to me.
4555671,Bhí Romulus agus Remus ina ndeartháireacha.,4474956,Romulus and Remus were brothers.
6319550,An féidir leat an cheist seo a fhreagairt?,58806,Can you answer this question?
7805166,Tá smaoineamh maith agam.,66724,I've got a good idea.
4668704,Oscail an doras.,39002,Open the door.
7809726,Ní thuigeann mé é.,1841686,I don't understand it.
5154954,Is bleachtaire é.,295668,He is a detective.
4555681,Cé a bhris an buidéal?,4555682,Who broke the bottle?
3561606,Táim ag éisteacht leis an amhrán seo.,3561604,I'm listening to this song.
7804584,Gabh mo leithscéal!,2425828,Excuse me!
7804899,Amach leat!,433518,Go away!
7804899,Amach leat!,7926273,Out you go!
6042343,Bhí mé an-thuirseach aréir.,244736,I was very tired last night.
7804865,Níl ocras orm.,1369181,I'm not hungry.
3785869,Ar do chomhairle a rinne mé é.,7926282,I did it following your advice.
4549669,"Tabhair an leabhar sin ar ais nuair atá sé léite agat, le do thoil.",7926295,"Return that book when you have read it, please."
7804519,Faraor!,3874107,Alas!
7809334,Níl aon beoir anseo.,423144,There's no beer here.
7804815,Scríobh chucu.,3905787,Write to them.
2502576,Níl mé tinn.,4773786,I am not sick.
4606559,Is fearr léi ceol ciúin.,315384,She prefers quiet music.
7292793,Is maith leo an Béarla.,306188,They like English.
5569835,Tá go leor airgid aige.,1534955,He has enough money.
7804880,Rith sé.,672229,He ran.
3390438,Beidh mé ag obair.,7926673,I will be working.
1467588,Go minic ithim úlla.,5101597,I often eat apples.
4773382,Tá tóin toirtiúil air.,7926685,He has a large arse.
7804882,Cén t-am é?,428402,What time is it?
7931805,Is doiligh an Bearla a fhoghlaim.,26207,English is difficult to learn.
3390441,Is óglach mé.,5858291,I'm a volunteer.
3603142,Is turasóir mé.,3856063,I'm a tourist.
8031089,Níl a fhios agam go fóill.,3944038,I still don't know yet.
8050258,Ceapaim go bhfuil mé líofa as Fraincis.,8049839,I think that I'm fluent in French.
8050266,Dúirt Mennad é mar sin.,8049753,Mennad said it like that.
8050286,Bhí sé sin ar an nuacht.,8049730,That was on the news.
8115273,Is maith liom labhairt Breatnais.,3528072,I like speaking Welsh.
5599883,An dtuigeann sibh?,403063,Do you understand?
8118061,Is maith leat liathdóirí.,20126,You like balls.
8176693,Is é Dúlais príomhchathair Oileán Mhanann.,7907443,Douglas is the capital of the Isle of Man.
8212669,Is Asarbaiseánach mé.,1771861,I'm Azerbaijani.
8212671,Tá grá agam ar mo bhean chéile.,436791,I love my wife.
8212672,Tá grá agam do mo bhean chéile.,436791,I love my wife.
8212674,Is mí Córán í Ramadan.,8208175,Ramadan is the month of the Quran.
8212669,Is Asarbaiseánach mé.,1771862,I'm Azeri.
7912662,Tuigeann tú mé.,1188207,You understand me.
2502514,Níl sí gránna.,8225877,She's not ugly.
2502514,Níl sí gránna.,8225878,She isn't ugly.
3602397,Níl rogha agam.,1877019,I have no choice.
3602397,Níl rogha agam.,1891182,I've got no choice.
3602397,Níl rogha agam.,4499875,I have no alternative.
8239915,Táim i mo chónaí sa Tuircméanastáin.,7914903,I live in Turkmenistan.
8239918,Bhí siad sáinnithe ar oileán tréigthe.,610679,They were marooned on a desert isle.
8239919,Is buachaill thú.,8220376,You're a boy.
8239928,Is é 2 faoin gcéad an ráta boilscithe na Seapáine.,8231059,Japan's inflation rate is 2%.
8239932,Tá bratacha gach tír sa domhan agam.,8223322,I have the flags of every country in the world.
8239936,Ná déan dearmad ar riail uimhir a trí.,8211277,Don't forget rule number three.
8239937,Stróic Tomás an nóta as a chéile.,2892365,Tom ripped up the note.
8239940,Níl a fhios ag aon duine cá bhfuil sé.,772806,Nobody knows where it is.
8239943,Is Íoslannach é mo chara is fearr.,8221504,My best friend is Icelandic.
8239945,Ní theastaíonn buachaill uait.,7986859,You don't need a boyfriend.
8239946,Seo leon.,8231066,Here is a lion.
8239949,Ba cheart duit do thicéad a cheannach roimh ré.,273603,You should buy your ticket in advance.
8239950,Go raibh maith agat roimh ré.,273600,Thanks in advance.
8239954,Níl sí cosúil linn.,8226426,She's not like us.
8239955,Cá bhfuil Tomás inniu?,3738869,Where's Tom today?
8239956,Is gadaí í.,8211830,She is a thief.
8240434,Nach gceapann tú go bhfuil na madraí cliste?,8240424,Don't you think dogs are smart?
8248859,Tuigim Breatnais ach níl mé in ann í a labhairt.,6106015,"I understand Welsh, but I can't speak it."
871633,Tá fear ag an doras atá ag iarraidh caint leat.,8264083,There's a man at the door who wants to speak with you.
8290306,Is fuath liom ríomhairí.,1801678,I hate computers.
8290309,Díolann mé ríomhairí.,2247404,I sell computers.
8290318,Thosaigh an ríomhaire.,3272395,The computer started.
8290324,Úsáideann mé ríomhairí.,3630761,I use computers.
8290325,Díolann Tom ríomhairí.,5454813,Tom sells computers.
8290328,Atosaigh do ríomhaire.,5628408,Restart your computer.
8290342,Scríos an ríomhaire.,6104480,Destroy the computer.
8290344,Tá an ríomhaire nua.,50353,The computer is new.
8290348,Úsáideann mé an ríomhaire.,254143,I use the computer.
8290363,Tá an ríomhaire as obair.,837409,The computer is broken.
8290368,Tá ríomhaire uaim.,1192601,I want a computer.
8290371,Úsáideann mé an ríomhaire sin.,1257296,I use that computer.
3602465,Tá ríomhaire agam.,1984328,I own a computer.
8290376,Tá trí ríomhairí agam.,2360411,I have three computers.
8290378,D'atosaigh Tom a ríomhaire.,2574435,Tom restarted his computer.
8290381,Teastaíonn ríomhaire uaim.,2631711,I need a computer.
8290383,Is fuath liom mo ríomhaire.,2821975,I hate my computer.
8290391,Is liomsa na ríomhairí seo.,3109185,These computers are mine.
8290397,Tá dhá ríomhairí ag Tomás.,3250964,Tom has two computers.
8290400,Ceannaíonn sé ríomhaire.,5961935,He buys a computer.
8290403,Ceannaíonn sí ríomhaire.,5961939,She buys a computer.
8290406,Is maith liom do ríomhaire.,5961959,I like your computer.
626918,Táim níos áille ná tusa.,8322917,I'm more beautiful than you.
8388993,An gá dom deifir a dhéanamh?,256856,Must I hurry?
3604279,Is liomsa é.,2123592,It's mine.
8586076,Ólaim fíon gach lá.,4902739,I drink wine every day.
8586078,Ólaim fíon.,5839914,I drink wine.
8716147,Fan abhaile.,8624434,Stay home.
8716148,Fanaigí abhaile.,8624434,Stay home.
8759753,Cá bhfuil an t-arán?,1529624,Where's the bread?
8759826,Úsáidim an ríomhaire sin.,1257296,I use that computer.
8759829,Úsáidim an ríomhaire.,254143,I use the computer.
8759833,Díolaim ríomhairí.,2247404,I sell computers.
8759881,Tá an-tuirse orm.,252193,I'm very tired.
8759908,Is í an áilleacht cúis na beatha.,1793483,Beauty is the reason of life.
7799824,D'aithin mé a glór.,8759986,I recognised her voice.
8759989,Tuigim.,433468,I understand.
8759997,Feicimid.,1031255,We see.
8760040,Bhíomar le do mháthair.,7801463,We were with your mother.
8760083,Múinteoir atá ionam.,259069,I am a teacher.
8760091,Is deargbhréagadóir é Donald Trump.,8749047,Donald Trump is a pathological liar.
3603064,Is Sasanach mé.,8762250,I'm English.
2714206,Rachaidh mé ansin ar eitleán.,4546233,I'll go there by plane.
8908400,D'fhoghlaimíomar an foréigean uaibh.,8908359,We learned violence from you.
8981397,Is linne an scoil seo.,59928,This school is ours.
6319321,Is féidir go ndúirt an dochtúir é sin.,9030299,The doctor might've said that.
9044794,"Cuir masc ort, le do thoil.",9042288,Please wear a mask.
9044795,"Cuir masc ort, led'thoil.",9042288,Please wear a mask.
9044809,Bhí an solas lasta sa chistin.,9044784,The light was on in the kitchen.
9044813,Bhí solas lasta sa halla.,9044672,A light was on in the hallway.
9044815,Tá ocht uaireadóir aici.,9044588,She has eight watches.
9044835,"Ar thaitin an scannán seo leat? ""Níor thaitin sé liom ar chor ar bith.""",9044671,"“Did you like the movie?” “No, not at all.”"
9044839,Is féidir linn labhairt faoi.,3181157,We can talk about it.
9044842,Níl an-ocras orm faoi láthair.,2542377,I'm not very hungry right now.
9044848,An Seapánach thú?,515572,Are you Japanese?
9044876,Is maith le Tomás agus a bhean chéile ceimic.,9043442,Tom and his spouse like chemistry.
9044884,Ní chreidfidh aon duine í.,9042852,Nobody will believe her.
9076825,Nach raibh a fhios agat go bhfuair sí bás tuairim is dhá bhliain ó shin?,2911258,Didn't you know that she passed away about two years ago?
9076851,Nach raibh a fhios agat gur cailleadh í tuairim is dhá bhliain ó shin?,2911258,Didn't you know that she passed away about two years ago?
9076922,"Ní hea, ní múinteoir mé. Níl ionam ach mac léinn.",2684545,"No, I'm not a teacher. I'm only a student."
9076932,Is smaoineamh maith é sin. Táim chun é sin a dhéanamh.,3591193,That's a good idea. I'm going to do that.
9158359,Tá cíocha móra aici.,784435,She has large breasts.
9158361,Déantar plúr as cruithneacht.,267675,Flour is made from wheat.
9311509,Ghlac Tom leis an chuireadh.,4495429,Tom accepted the invitation.
9311523,Ólann siad ola olóige.,8445531,They drink olive oil.
9317355,Rinne Tom gach rud go mícheart.,9317346,Tom did everything wrong.
9464307,An bhfuil seomra agat?,9457399,Do you have a room?
9464456,Is múinteoir an-dian é Tomás agus ní maith le páistí é.,7953716,Tom is a very strict teacher and children do not like him.
9464470,Tá seoladh Thomáis agam áit éigin i mo ríomhaire.,4081900,I've got Tom's address somewhere on my computer.
9464473,Tá Tomás ag scríobh a thráchtas dochtúireachta faoi láthair.,9464466,Tom is writing his doctoral thesis at the moment.
9464475,Níor thóg mé leabhar Thomáis.,8398983,I didn't take Tom's book.
9464485,Cabhrú liom an tolg seo a bhogadh.,4666677,Help me move this couch.
9466086,Caithfidh tú dul abhaile anois.,9466081,You have to go home now.
9472023,Tháinig Tomás den bhus agus thosaigh sé ag siúl abhaile.,8398436,Tom got off the bus and started walking home.
9472028,Níl aon leigheas ar tromluithe.,1624877,There is no cure for nightmares.
9472031,Is ise iad na buataisí seo.,59574,These boots belong to her.
9516113,Uaibh-sean a fhoghlaimíomar an foréigean.,8908359,We learned violence from you.
9518479,Dún do chlab.,9518462,Shut your trap.
9524237,Táim ag foghlaim Aramaise.,5826752,I'm learning Aramaic.
9524267,Tá corp Thomáis sa marbhlann anois.,9524248,Tom's corpse is in the mortuary now.
9570979,Is mór againn príobháideachas.,9570741,We value privacy.
9570985,Tabharfaidh mé óráid amárach.,9570962,I'll give a speech tomorrow.
9663160,Is iníon léinn í.,3083897,She's a student.
9663162,"Is iníon léinn í, nach ea?",8526691,"She's a student, isn't she?"
9663165,"Is iníon léinn í freisin, nach ea?",8527703,"She's a student too, isn't she?"
9663169,Ní ag magadh atáim in aon chor.,9663150,I'm not joking at all.
4521754,Tá tú chomh saothrach le beach i gcónaí.,9729410,You're always as busy as a bee.
9965179,An cat mé?,9963970,Am I a cat?
9965182,Chuir Yanni an bolgán solais i gcoimeádán dúnta go daingean.,9962225,Yanni put the light bulb into a sealed container.
9965184,Úsáideann na bolgáin solais seo mearcair chun solas a chruthú.,9962220,These light bulbs use mercury to create light.
9965188,An saoránaigh Mheiriceá sibh?,9962272,Are you US citizens?
9965191,Cén fáth nach dtéimid go dtí oifig Thomáis?,9962271,Why don't we go to Tom's office?
9965530,Tá deich dteanga aici.,307967,She is able to speak ten languages.
9965534,Tá sí ábalta deich dteanga a labhairt.,307967,She is able to speak ten languages.
9965539,Cé chomh luath agus is féidir leat é a fháil déanta?,3636336,How soon can you get it done?
9965549,Teastaíonn duine uainn chun rud a dhéanamh.,9965526,We need someone to do something.
9965554,Ba é smaoineamh Thomáis é.,1897735,It was Tom's idea.
9965561,Tá an leabhar seo ró-leadránach.,9095234,This book is too boring.
9965564,Ní maith leis an mbean peil.,5331208,The lady does not like football.
9965566,Is Sualannaigh sibh.,1141544,You guys are Swedish.
9965572,Shuigh sí ar an urlár agus dhún sí a súile.,8798788,She sat on the floor and closed her eyes.
9965577,Tabharfaidh mé duitse é.,2548323,I'll give it to you.
4555648,Tabharfaidh mé duit é.,2548323,I'll give it to you.
9965585,Sin í an áit a bhfuilim i mo shuí.,3222940,That's where I sit.
9965593,Is liomsa an ríomhaire glúine seo.,3271936,This laptop belongs to me.
9965597,Ní raibh aon duine ann sa sráidbhaile.,274565,There were no people in the village.
9965602,Tá an tae ró-the.,7552505,The tea is too hot.
9965606,Tá tú fós ró-óg.,9394545,You're still too young.
9965609,Tá an cailín ró-chúthail.,9951092,The girl is too shy.
3603158,Is altra mé.,256726,I'm a nurse.
3603121,Is bean tí mé.,1764900,I'm a housewife.
3102203,Ní féidir le duine a bhás a fháil ó choinneáil istigh a anála.,6873368,You can't kill yourself by holding your breath.
10258320,Tá sé i bhfostú i d'intinn arís.,7801207,It's stuck in your mind again.
10258347,I ndáiríre? Cén fáth?,505876,Really? Why?
10258349,I ndáiríre? Cad ina thaobh?,505876,Really? Why?
10258389,A Dhia!,2573476,Omigod!
10258435,An bhfuil a fhios agat a raibh a gcinniúint?,7131700,Do you know what their fate was?
1577343,D'fhreagair Smith go raibh brón ort,10274411,Smith replied that you were sorry.
2988432,Ba mhaith liom leabhar a scríobh.,5150012,I'd like to write a book.
10309088,Tá straitéis níos fearr uainn.,9489369,We need a better strategy.
10309089,Teastaíonn straitéis níos fearr uainn.,9489369,We need a better strategy.
10309091,Dúirt Tomás agus Máire nach bhfágfaidís go luath riamh.,7436549,Tom and Mary said that they'll never leave early.
2951301,Caithfidh mé imeacht.,2245988,I must leave.
10317053,Tá orm imeacht.,2245988,I must leave.
10317059,Is deoch draíochta í.,6090573,It's a magic potion.
10317060,Deoch draíochta is ea í.,6090573,It's a magic potion.
10317066,Deoch draíochta atá inti.,6090573,It's a magic potion.
10317068,Bhí mé á lorg i ngach áit.,10317065,I was looking for her everywhere.
10317070,Is í an tríú cathair is mó sa tSeirbia í.,338376,It's the third biggest city in Serbia.
10317072,Chuir John Kerry in éadan an smaoineamh seo.,807018,John Kerry opposed this idea.
10317078,Tá ainm an chailín sin ar eolas agam.,6157115,I know that girl's name.
10317079,Tá a fhios agam ainm an chailín sin.,6157115,I know that girl's name.
10317087,Ní dóigh liom go bhfuil caidreamh taidhleoireachta ag an Ailgéir leis an gCosaiv.,7811307,I don't think Algeria has diplomatic relations with Kosovo.
10317089,Cad a thóg tú pictiúr de?,3308279,What did you take a picture of?
10317091,An é do chéad chuairt ar an tSeapáin é?,267007,Is this your first visit to Japan?
10317095,Ní dhearna mé é sin ach aon uair amháin.,6220619,I only did that one time.
10317096,Chuaigh Máire a luí go sásta.,7927556,Mary went to sleep happy.
10317098,An bhfeicfidh mé arís í?,10317077,Will I see her again?
10317100,Ba mhaith liom bualadh léi arís.,10317058,I want to meet her again.
10317102,Ní chaillfidh mé an cruinniú seo.,10317003,I'm not missing this meeting.
10317103,Tá sé fíorleadránach.,10317011,It is extremely boring.
10317113,An bhfuil a fhios agat conas cipíní itheacháin a choinneáil i gceart?,10317015,Do you know how to hold chopsticks properly?
10317114,An bhfuil a fhios agat conas greim a choinneáil ar cipíní itheacháin i gceart?,10317015,Do you know how to hold chopsticks properly?
10317117,Ná cuir teachtaireachtaí chugam.,10317000,Don't send me messages.
10317119,Ná seol teachtaireachtaí chugam.,10317000,Don't send me messages.
10317121,Cad a cheannóidh tú?,10316999,What are you buying?
10317122,Céard a cheannóidh tú?,10316999,What are you buying?
10317124,Nílim ag iarraidh slaghdán a fháil.,10316998,I do not want to catch a cold.
10317126,Ní theastaíonn uaim slaghdán a fháil.,10316998,I do not want to catch a cold.
10317138,Ní fhéadfainn liom Tomás a phiocadh suas ag an aerfort.,9431897,I wasn't able to pick up Tom at the airport.
10317141,Tá tuirse ar Tomás agus Máire.,2645957,Tom and Mary are tired.
10317149,Is é an ceann ball den chorp an duine é.,2687340,The head is a part of the human body.
10317272,Fuair mé saor in aisce é.,42714,I got it free.
10317276,Ní theastaíonn lón uaim.,277596,I don't want lunch.
10317278,Ní theastaíonn dinnéar uaim.,324626,I don't want dinner.
10317279,Ní theastaíonn sé uaim.,452696,I don't want it.
10317280,Níl sé uaim.,452696,I don't want it.
10317282,Ní theastaíonn feoil uaim.,453790,I don't want meat.
10317283,Níl feoil uaim.,453790,I don't want meat.
10317287,Ní theastaíonn aon rud uaim.,1334408,I don't want anything.
10317288,Níl aon rud uaim.,1334408,I don't want anything.
10317290,Ní theastaíonn páistí uaim.,1855053,I don't want kids.
10317291,Níl páistí uaim.,1855053,I don't want kids.
10317292,Níl sé seo uaim.,1887277,I don't want this.
10317293,Ní theastaíonn ceann uaim.,2011334,I don't want one.
10317294,Níl ceann uaim.,2011334,I don't want one.
10317295,Níl tae uaim.,2011335,I don't want tea.
10317296,Níl sé sin uaim.,2011361,I don't want that.
10317297,Níl lón uaim.,277596,I don't want lunch.
10317298,Níl siad uaim.,2011362,I don't want them.
10317300,Níl trioblóid uaim.,2011555,I don't want trouble.
10317301,Ní theastaíonn trioblóid uaim.,2011555,I don't want trouble.
10317305,Níl Seapáinis agam.,1482,I don't speak Japanese.
10317306,Ní labhraím Seapáinis.,1482,I don't speak Japanese.
10317307,Níl Sínis agam.,436563,I don't speak Chinese.
10317308,Ní labhraím Sínis.,436563,I don't speak Chinese.
10317309,Ní labhraím Sualainnis.,482348,I don't speak Swedish.
3601099,Níl Gearmáinis agam.,482351,I don't speak German.
10317311,Ní labhraím Gearmáinis.,482351,I don't speak German.
10317312,Ní labhraím Catalóinis.,515726,I don't speak Catalan.
10317313,Níl Catalóinis agam.,515726,I don't speak Catalan.
10317315,Táim ag foghlaim.,5338466,I'm learning.
10317316,Tá mé ag foghlaim.,5338466,I'm learning.
10317317,Táim ag foghlaim ceoil.,252221,I'm learning music.
10317319,Táim ag foghlaim Seicise.,890349,I'm learning Czech.
10317320,Táim ag foghlaim Bascaise.,975767,I'm learning Basque.
10317321,Táim ag foghlaim Béarla.,1188743,I'm learning English.
10317322,Táim ag foghlaim Seapáinise.,1371730,I'm learning Japanese.
10317323,Táim ag foghlaim Tuircise.,1437342,I'm learning Turkish.
10317324,Táim ag foghlaim Sínise.,2116405,I'm learning Chinese.
10317326,Táim ag foghlaim Fraincise.,2451669,I'm learning French.
10317327,Táim ag foghlaim pianó.,2248056,I'm learning piano.
10317328,Is féidir le páistí fiú é a thuiscint.,245815,Even children can understand it.
10317356,Tá Baile Átha Cliath in Éirinn.,2974636,Dublin is in Ireland.
10317357,Táim réidh chun é sin a dhéanamh duitse.,5915825,I'm ready to do that for you.
10317360,Tá tiomáint ag Tomás.,2236147,Tom can drive.
10317362,Tá an dara seimeastar thart.,494252,Second semester has ended.
10317363,Tháinig deireadh leis an dara seimeastar.,494252,Second semester has ended.
10317364,Chríochnaigh an dara seimeastar.,494252,Second semester has ended.
10317366,Múineann Tomás.,2203852,Tom teaches.
10317370,Ba é sin an chéad uair a bhuaileamar le chéile.,1504235,That was our first encounter.
10317374,Ní adhmóidh Tomás go bhfuil dul amú air.,6262587,Tom won't admit that he's wrong.
10317376,Ní adhmóidh Tomás go bhfuil sé contráilte.,6262587,Tom won't admit that he's wrong.
10317377,Ní adhmóidh Tomás go bhfuil sé mícheart.,6262587,Tom won't admit that he's wrong.
10317381,Tá laethanta níos fearr feicthe acu.,4903394,They've seen better days.
10317384,Déan iarracht gan an botún céanna a dhéanamh agus a rinne mé.,10138294,Try not to make the same mistake I did.
10317393,Níl gach reiligiún diachiúil.,10317263,Not all religions are theistic.
10317397,Tá do sheanathair an-dáimhiúil.,4104413,Your grandfather is very charismatic.
10317399,Gearradh príosún saoil air.,1042329,He has a life sentence.
10317400,Thug mé isteach.,2863162,I gave up.
10317402,Thug mé ceann.,2873108,I gave one.
10317403,Thug mé samplaí.,9241098,I gave examples.
10317404,Thug mé do charr.,1121379,I gave your car.
10317406,Dúirt mé m'fhocal.,2266966,I gave my word.
10317407,Thug mé m'fhocal.,2266966,I gave my word.
10317408,Thug mé ar ais é.,2329335,I gave it back.
10317409,Thug mé seacláid do Mháire.,2480372,I gave Mary chocolate.
10317410,Thug mé gach rud do Thomás.,3024343,I gave Tom everything.
10317411,D'éirigh mé as.,3151408,I gave my notice.
10317414,Thug mé gach rud dóibh.,3916502,I gave them everything.
10317415,Thug mé gach rud dó.,3916503,I gave him everything.
10317416,Thug mé gach rud di.,3916504,I gave her everything.
10317417,Labhraím Fraincis níos fearr ná a labhraím Béarla.,6342262,I speak French better than I speak English.
10317418,Labhraím Fraincis níos fearr ná Béarla.,6342262,I speak French better than I speak English.
10317419,Thréig na háitritheoirí an baile.,638214,The town was deserted by its inhabitants.
10317422,An dochtúir é?,293616,Is he a doctor?
10317423,Aontaíonn gach duine leat.,32111,Everybody agrees with you.
10317425,Seo mo mhadra.,8837930,Here's my dog.
10317426,Is mo mhadra é seo.,67056,This is my dog.
10317427,Seo é mo mhadra.,67056,This is my dog.
10317428,Sin é mo mhadra.,1549917,That is my dog.
10317429,Is mo mhadra é sin.,1549917,That is my dog.
10317433,Ní fhaca mé cé a tháinig.,6272835,I didn't see who came.
10317435,Is amadán é mo dheartháir.,401444,My brother is an idiot.
10317436,Amadán is ea mo dheartháir.,401444,My brother is an idiot.
10317439,Mharaigh sé é féin leis an ól.,293852,He drank himself to death.
10317440,Chuir sé é féin den saol leis an ól.,293852,He drank himself to death.
10317448,Is bréagíobairt í fíoríobairt.,10317421,A true sacrifice is a false sacrifice.
10317472,Chuir Tomás ceist orm cérbh é mo mhúinteoir Fraincise.,2956041,Tom asked me who my French teacher was.
10317476,Táim chun scaradh le Tomás.,6657093,I'm going to break up with Tom.
10317478,Táim chun briseadh suas le Tomás.,6657093,I'm going to break up with Tom.
10317482,Tugann Tomás Daidí ar a athair fós.,6529894,Tom still calls his father Daddy.
10317483,Tá asma uirthi.,4426693,She has asthma.
10317487,Díreach toisc gur mac tíre mé glacann gach duine leis gur drochdhuine mé.,9808974,"Just because I'm a wolf, everybody assumes I'm a bad guy."
10317489,Chuir Tomás an iris ar an mbord íseal.,3156767,Tom put the magazine on the coffee table.
10317491,An bhfuil tú ag insint na fírinne dom faoi Thomás?,10272665,Are you telling me the truth about Tom?
10317493,B'fhéidir gur tréatúir é Tomás.,5193734,Tom may be a traitor.
10317494,Ceapaim go bhfuil tú go hiontach.,7136678,I think that you're terrific.
10317495,Sílim go bhfuil tú go hiontach.,7136678,I think that you're terrific.
10317496,Thug sí fuil chun a deirfiúr a shábháil.,6171133,She gave blood in order to save her sister.
10317498,Tá súil agam nach bhfaighidh Tomás agus Máire bata agus bóthar óna bpost.,6518092,I hope Tom and Mary don't get fired.
10317500,Is féidir le Yanni ithe níos tapúla ná sin.,10108093,Yanni can eat faster than that.
10317509,An bhfuil tú chun gléasadh i bhfeisteas i mbliana?,4328675,Are you going in costume this year?
10317520,Is tír chaipitlíoch í an tSín.,10210841,China is a capitalist country.
10317524,Táim déghnéasach fós.,10317504,I'm still bisexual.
10317528,Bhí culaith scáinte air.,329650,He was wearing a threadbare suit.
10317529,Cén ollscoil a ndeachaigh tú ann?,6864793,What university did you go to?
