5538483,Tá páistí Tom thíos staighre.,5530174,Tom's children are downstairs.
5538494,Níl ach cluiche é seo.,5529413,This is just a game.
5542442,Tá mé buartha.,2111746,I'm concerned.
5542503,Tá mé ag labhairt le mo mhac léinn.,703243,I'm speaking with my student.
4773211,"Bíonn cuma áthais uirthi i gcónaí, ach níl áthas uirthi ar chor ar bith.",5556847,"She always looks happy, but she is not happy at all."
4773211,"Bíonn cuma áthais uirthi i gcónaí, ach níl áthas uirthi ar chor ar bith.",5556850,"She is always looking happy, but she is not happy at all."
5563709,Comhghairdeas!,1437,Congratulations!
5563713,Cearr.,28129,Wrong.
5563714,Mícheart.,28129,Wrong.
5563716,Cad é?,36088,What?
5564580,Is maith an t-anlann an t-ocras.,18157,Hunger is the best sauce.
651199,Aithníonn ciaróg ciaróg eile.,280288,Birds of a feather flock together.
5564584,Bíonn cluasa ar an gcoill.,2376,The walls have ears.
5564585,Bíonn cluasa ar na claíocha.,2376,The walls have ears.
5564592,Folaíonn grá gráin.,453394,Love is blind.
5542375,An bhfuil an leabhar agaibh?,2502611,Do you have the book?
5228199,An bhfuil fear an tí sa mbaile?,5564654,Is the householder at home?
5564670,Aontaím leis an ráiteas.,5564672,I agree with the statement.
5569800,"Má bheadh airgead agam, cheannóin ticéid don cheolchoirm.",5569801,"If I had money, I would buy tickets for the concert."
5569929,An ríomhchláraitheoir í?,310870,Is she a computer programmer?
5569821,Tá go leor airgid agam.,2657676,I have enough money.
4646724,Bhí mé ag an bpicitúrlann.,750642,I was at the cinema.
752743,Téim go dtí an phictiúrlann uair amháin sa seachtain.,5571928,I go to the cinema once a week.
4773426,Rugadh mé i 1988.,753316,I was born in 1988.
4616522,Cén fáth?,36419,Why?
5585530,Cad chuige?,36419,Why?
5592152,"Bhí an fear bocht sínte amach ar an talamh, gan aithne gan urlabhra.",5592155,"The poor man was stretched out on the ground, unconscious."
5592176,Ba bheag nár thit mé i laige nuair a chuala mé an scéal.,5592179,I nearly fainted when I heard the story.
5592184,Bhí sé tuirseach traochta.,3100402,He was exhausted.
5592187,Táim tuirseach traochta.,39824,I'm worn out.
5592195,Dochreidte!,844055,Incredible!
5592743,Chuir Tomás a fhéinphic ar líne.,5592747,Tom put his selfie online.
5592749,Chuir Tomás a fhéinín ar líne.,5592747,Tom put his selfie online.
5593026,Brostaigh!,1182334,Hurry!
2714643,An bhfuil Béarla aige?,293951,Does he speak English?
874938,Rugadh Caitríona in 1985.,5598939,Catherine was born in 1985.
5228134,Tá sé ceart go leor.,4645428,It's all right!
5599784,Tá brón orm...,39996,Sorry...
5599790,Fáilte romhat.,138919,Welcome.
5599791,Fáilte romhaibh.,138919,Welcome.
5599792,Faoi dheireadh!,392296,Finally!
5599795,Le do thoil.,393357,Please.
5599798,Le bhur dtoil.,393357,Please.
5599799,Mas é do thoil é.,393357,Please.
5599801,Mas é bhur dtoil é.,393357,Please.
5599817,Léim.,631038,Jump.
5599819,Léimigí.,631038,Jump.
2795456,Bí cúramach!,1053192,Careful!
5599829,Bígí cúramach!,1053192,Careful!
5599832,Déanta.,1357603,Done.
5599834,Cacamas.,1445743,Bullshit.
5599841,Maith thú!,1507459,Attaboy!
5599855,Arís?,1598991,Again?
5599857,Fan!,1744314,Wait!
5599860,Fanaigí!,1744314,Wait!
5599875,AGOA!,2770644,Lol!
5599881,Tuigthe.,2897145,Understood.
5599882,An dtuigeann tú?,3133955,Understand?
5599883,An dtuigeann sibh?,3133955,Understand?
5614601,Is cuma liom.,2323,I don't care.
5614601,Is cuma liom.,42384,It makes no difference to me.
5614601,Is cuma liom.,42845,It's the same to me.
5614601,Is cuma liom.,255222,It's all the same to me.
5614601,Is cuma liom.,257396,I don't mind.
5614616,Is bean rialta í.,2276593,She's a nun.
5614617,Tá na mná rialta ag canadh.,1125088,The nuns are singing.
5621927,Ní mian liom ceapairí ar bith.,253865,I don't want any sandwiches.
3898620,An Rúiseach thú?,5624137,Are you Russian?
1467586,Ithim úlla go minic.,5101597,I often eat apples.
3930990,Yohannis is ainm dom.,5624138,My name is Yohannis.
4606581,Táim ag iompar clainne.,348596,I'm pregnant.
5570616,Chaill mé m'eochair.,1799986,I lost my keys.
4606563,Is mian liom foclóir maith.,453183,I want a good dictionary.
5626038,Bhí greim daingean ag an Eaglais Chaitliceach ar an tsochaí.,5626040,The Catholic Church had a strong grip on society.
5635929,Nílim claonta.,2912868,I have no prejudice.
5648213,Cad a tharla?,375822,What happened?
5648268,Bhain siad an ceann scríbe amach.,3806342,They reached their destination.
5648314,D'éirigh le Tomás.,2203837,Tom succeeded.
5648453,Níl sé thar mholadh beirte.,1915930,It's nothing to write home about.
5648859,D'éist Tomás go géar.,2237178,Tom listened attentively.
5648892,Bhí Tomás ag caitheamh tobac.,2239852,Tom was smoking.
5648897,Tá Tomás ag caitheamh tobac.,2107602,Tom's smoking.
5648897,Tá Tomás ag caitheamh tobac.,1662944,Tom is smoking.
5649004,Bhí Tomás ar buile.,1533419,Tom was furious.
5649007,Tá Tomás ar buile.,1868211,Tom is furious.
5650983,Fuair Tomás léasadh teanga.,5650982,Tom received a tongue lashing.
5670084,Nollaig Shona!,1723,Merry Christmas!
5670086,Nollaig Shona duit!,1723,Merry Christmas!
5228197,Ní féidir liom labhairt.,609291,I can't talk.
873148,An é Seán atá ag obair?,5678795,Is it Seán that's working?
5015987,Tá páirc álainn i lár an bhaile.,5678800,There is a beautiful park in the center of the town.
4549682,"Bhí triúr mac ag a mháthair, agus is é an mac is óige.",5678814,"His mother had three sons, and he was the youngest."
4606579,Is é an buachaill sin a dheartháir.,68199,That boy is his brother.
5684853,Tá sé soiléir nach bhfuil puinn daonnachta ag Tomás.,5684856,It's clear Tom doesn't have an ounce of humanity.
5685095,Níl fonn cainte ar Tomás.,5685094,Tom is not in the mood for talking.
5228129,Tá aithne mhaith agam ar an bpáirt seo den chathair.,5699720,I know this part of the city well.
5759634,Bhí Tomás ag plobaireacht.,2239737,Tom was babbling.
5807826,"Nuair a bhíonn an cat amuigh, bíonn an luch ag rince.",5807830,"When the cat leaves, the rat dances."
5840817,Táim i ngrá.,2248037,I'm in love.
5844627,Gan aon agó!,20042,Without a doubt!
3785873,Bhí moladh ag gach duine uirthi.,6091902,Everybody had advice for her.
5978202,Is é an bheatha an t-uisce.,3861611,Water is life.
6031854,Tá seascair daoine i mo scoil.,6091901,There are seven people in my school.
6037051,Tá cúpla daoine uaim chun cabhair a tabhairt dom.,6036333,I need a few people to help me.
6037054,An bhfuil Mary sa ghairdín?,6035834,Is Mary in the garden?
6042347,Ba mhaith liom caint leatsa.,252725,I want to talk to you.
6077699,Is banríon draig é.,2282264,He's a drag queen.
6091903,Tá an bhean ag caint gan stad gan staonadh.,6091905,The woman is talking non-stop.
6091908,Ní raibh sé ag éisteacht léi.,6091909,He wasn't listening to her.
6091914,Cé dúirt é sin leat?,2646712,Who said that to you?
6091916,Bhí a háit aici sa chomhluadar.,6091919,She had a place in society.
6091920,Ní athraíonn rud ar bith ó thús go deireadh,6091922,Nothing changes from beginning to end.
6091923,Is duine cainteach í.,6091924,She is a talkative person.
6091926,Téann sí siar ar a focal.,6091927,She goes back on her word.
6091932,Níl sé sásta ar chor ar bith.,6091933,He wasn't at all satisfied.
6091935,Ní thugann sé aon tacaíocht di.,6091936,He doesn't give her any support.
6091937,Dúirt an bean gur mhaith léi dul ag obair í féin.,6091938,The woman said that she would like to work herself.
6319247,"Má tá tú ag iarraidh bheith ag caint, bímis.",2014730,"If you want to talk, let's talk."
6319250,An é sin an rud ba mhaith leat mé a rá?,2014731,Is that what you want me to say?
6319252,An é sin an chúis a bhfuil tú ag iarraidh mé a ghortú?,2014732,Is that why you want to hurt me?
6319253,An é sin an chúis a bhfuil tú ag iarraidh mé a mharú?,2014733,Is that why you want to kill me?
6319254,Ni rud é a bhfuil fonn orm a dhéanamh.,2014734,It isn't something I want to do.
6319257,Cuir in iúl dom cad é atá tú ag iarraidh a dhéanamh.,2014735,Let me know what you want to do.
6319259,Ba mhaith le mo thuismitheoirí mé a theacht abhaile.,2014736,My parents want me to come home.
6319263,Mar sin cad é ba mhaith leat mé a dhéanamh?,2014737,So what is it you want me to do?
6319264,Sin é go díreach an rud atá mé ag iarraidh a chloisteáil.,2014738,That's just what I want to hear.
6319265,Tá rud ann ar mhaith liom triail a bhaint as.,2014739,There's something I want to try.
6319267,Tá fonn ar an mbeirt acu rud éigin a rá.,2014740,They both want to say something.
6319270,Níl siad ach ag iarraidh duine éigin leis an locht a chur air.,2014741,They just want someone to blame.
6319272,Tá siad ag iarraidh Tom a fhanacht thar oíche.,2014742,They want Tom to stay overnight.
6319273,Ní maith le Tom agus Mary go bhfuilimid anseo.,2014743,Tom and Mary don't want us here.
6319274,Tá Tom agus Mary ag iarraidh labhairt liom.,2014744,Tom and Mary want to talk to me.
6319275,Ní raibh Tom ag iarraidh mé lámh a leagan air.,2014745,Tom didn't want me to touch him.
6319276,Níl Tom á iarraidh sin faoi láthair.,2014746,Tom doesn't want that right now.
6319277,Níl Tom ag iarraidh dul a chodladh.,2014747,Tom doesn't want to go to sleep.
6319278,Níl Tom ag iarraidh bheith ag caint leat.,2014748,Tom doesn't want to talk to you.
6319279,Níl Tom ag iarraidh ach greim le hithe.,2014749,Tom just wants something to eat.
6319280,Dúirt Tom nach raibh sé ag iarraidh dí.,2014750,Tom said he didn't want a drink.
6319281,Dúirt Tom nach raibh sé ag iarraidh bheith ag caint.,2014751,Tom said he didn't want to talk.
6319282,Dúirt Tom go raibh comhluadar uaidh.,2014752,Tom said he wanted some company.
6319283,Bhí Tom ag iarraidh mé gar a dhéanamh dó.,2014753,Tom wanted me to do him a favor.
6319284,Bhí Tom ag iarraidh mé a fheiceáil láithreach bonn.,2014754,Tom wanted to see me right away.
6319285,Tá Tom ag iarraidh bheith cosúil lena athair.,2014755,Tom wants to be like his father.
6319286,Ba mhaith le Tom scaradh le Mary.,2014756,Tom wants to break up with Mary.
6319287,Tá Tom ag iarraidh thú a fheiceáil thíos staighre.,2014757,Tom wants to see you downstairs.
6319288,Tá fonn ar Tom am a chaitheamh liom.,2014758,Tom wants to spend time with me.
6319289,Ba mhaith le Tom go mbainimid taitneamh as.,2014759,Tom wants us to enjoy ourselves.
6319290,"A Tom, uaitse atá mé ag iarraidh é a chloisteáil.",2014760,"Tom, I want to hear it from you."
6319291,"A Tom, ba mhaith liom thú a theacht liomsa.",2014761,"Tom, I want you to come with me."
6319292,"A Tom, ba mhaith liom thú a éisteacht liom.",2014762,"Tom, I want you to listen to me."
6319293,Nílimid ag iarraidh drochphoiblíochta.,2014763,We don't want any bad publicity.
6319294,Níl tuilleadh botún ar bith uainn.,2014764,We don't want any more mistakes.
6319295,Nílimid ag iarraidh trioblóide.,2014765,We don't want to be any trouble.
6319296,Nílimid ag iarraidh Tom a scanrú ar shiúl.,2014766,We don't want to scare Tom away.
6319297,Nílimid ag iarraidh geit a bhaint as éinne.,2014767,We don't want to startle anyone.
6319298,Nílimid ag iarraidh ach rudaí a dhíol leat.,2014768,We just want to sell you things.
6319299,Ba mhaith linn rud a phlé le Tom.,2014769,We want to have a word with Tom.
6319300,Ba mhaith linn thú taitneamh a bhaint as.,2014770,We want you to have a good time.
6319301,Bhíomar ag iarraidh an t-ádh a ghuí leat.,2014771,We wanted to wish you good luck.
6319302,Cad é nach raibh Tom ag iarraidh thú a fheiceáil?,2014772,What didn't Tom want you to see?
6319303,Cad é go díreach atá tú ag iarraidh a fháil uainn?,2014773,What do you really want from us?
6319304,Cad é ba mhaith leat mé a thabhairt ort?,2014774,What do you want me to call you?
6319305,Cár mhaith leat mé a thosú?,2014775,What do you want me to start on?
6319306,Cad é ba mhaith leat mé a rá leat?,2014776,What do you want me to tell you?
6319307,Cad é nach bhfuil Tom ag iarraidh muid a fheiceáil?,2014777,What doesn't Tom want us to see?
6319308,Cad eile atá tú ag iarraidh mé a rá leat?,2014778,What else do you want me to say?
6319309,Cén fáth a bhfuil Tom ag iarraidh muidne a dhéanamh seo?,2014779,Why does Tom want us to do this?
6319310,Cén fáth ar chóir do Tom Mary a fheiceáil?,2014780,Why should Tom want to see Mary?
6319311,Cén fáth a mbeidís ag iarraidh Tom a ghortú?,2014781,Why would they want to harm Tom?
6319312,Cén fáth a mbeadh Tom ag iarraidh Mary a ghortú?,2014782,Why would Tom want to hurt Mary?
6319314,Cén fáth a mbeimis ag iarraidh pionós a chur ort?,2014783,Why would we want to punish you?
6319315,Ar mhaith leat triail a bhaint as?,2014784,Would you like to give it a try?
6319317,Is féidir leat seasamh suas más maith leat.,2014785,You can stand up if you want to.
6319318,Tá a fhios agat cad é atá mé ag iarraidh thú a rá liom.,2014786,You know what I want you to say.
6319319,Is dócha gur chóir duit moilliú.,2014787,You may want to slow down a bit.
6319320,Phós sí é nuair a bhí sí 20 d'aois.,1126713,She married him when she was 20.
6319321,Is féidir go ndúirt an dochtúir é sin.,1126714,The doctor might have said that.
6319322,Tá na Seapánaigh ina n-oibrithe an-díograiseacha den chuid is mó.,1126715,"Generally, the Japanese are very diligent workers."
6319323,Is eagal liom a rá go bhfuil sé imithe agus ní fhillfidh sé choíche.,1126716,"I regret to say that he's gone, never to return."
6319324,Cheap cailín a méara sa doras.,1126717,A girl caught her fingers in the door.
6319325,In am is i dtráth.,1126718,All in good time.
6319326,Is tusa ár ndóchas amháin.,1126719,You are our only hope.
6319327,Cén fáth a bhfuil tú ag fágáil sláin?,1126721,Why are you saying goodbye?
6319328,Chuaigh mé amach le gealt.,1126722,I've dated a lunatic.
6319336,"Is téarma é seo a chuireann síos ar théamh domhanda, rud atá ina thoradh na dé-ocsaíde carbóin san atmaisféar atá ag dul i méid i gcónaí.",1126723,"This is a term used to describe the warming of the earth, due to growing amounts of carbon dioxide in the atmosphere."
6319337,Níl ionat ach bean as a meabhair!,1126724,You are one disturbed woman!
6319344,Ní thuigfeá go brách cé chomh pianmhar agus atá sé é seo a rá leat.,1126725,You have no idea how painful it is to say this.
6319345,Cén chaoi a ndeachaigh tú isteach i mo sheomra?,1126726,How did you get into my room?
6319350,Caithfear cabhair a dhéanamh ar chairde in am an ghátair.,1126727,One must help friends in times of such need.
6319355,"Nuair a thugaim cuairt ar mo gharmhac, tugaim rud éigin liom dó i gcónaí.",1126729,"When I go to see my grandson, I always give him something."
6319358,Beidh coinne agam le m'iarleannán.,1126730,I'm going to have a date with my ex.
6319530,Ba bheag duine nár tháinig in am.,434192,Almost everyone arrived on time.
6319531,"Cé gur duine óg é, tá féasóg liath air.",434194,"Although he's young, he has a grey beard."
6319533,"Cé nach bhfuil mórán airgid, tá fonn orm an péintéireacht seo a cheannach.",434196,"Although we don't have much money, I want to buy this painting."
6319556,Ceapaim gur chóir duit leithscéal a dhéanamh di.,11374,I think that you ought to apologize to her.
3598622,Tá sin go hálainn.,2111460,That's beautiful.
6319603,Aontaím leat faoin bpointe seo.,253702,I agree with you on this point.
6319619,Aontaím.,436281,I agree.
6742972,Lá Idirnáisiúnta na mBan sona!,3082628,Happy International Women's Day!
4555673,An mbeidh sé te arís amárach?,323252,Will it be hot again tomorrow?
6824278,Is mise Ricardo.,3341588,I'm Ricardo.
6031882,Tá mó dheirfiúr álainn.,7001865,My sister is beautiful.
6319629,Cad é a bhí tú a dhéanamh?,376075,What were you doing?
6824278,Is mise Ricardo.,6015388,I am Ricardo.
7067950,Ólaim uisce.,7932256,I drink water.
7067952,Tá úll agat.,7067954,You have an apple.
7067957,Itheann sí arán.,7067958,She eats bread.
7067959,Ólann sé.,7067961,He drinks.
7067963,Itheann Pól.,7067964,Paul eats.
7073205,Tá uisce agat agus ólann tú é.,7073206,You have water and you drink it.
7073207,Ithim rís.,7073209,I eat rice.
7073210,Táimid agus tá na fir.,7073211,We are and the men are.
7075957,Léim an leabhar.,989164,I read the book.
7075958,Tá buachaill aici.,7075959,She has a boyfriend.
7075960,Tá an rís agus ceapaire aige.,7075961,He has the rice and a sandwich.
7075962,Itheann na páistí.,7075963,The children eat.
7075964,Ólann sé bainne agus ólaimid uisce.,7075965,He drinks milk and we drink water.
7075967,Tá nuachtán agam.,7075969,I have a newspaper.
871639,Cheap mé go bhfaca mé duine ansin.,7174170,I thought that I saw someone there.
7290675,Gheofá bainne a bhaint as na ba.,7290677,You could get milk from the cows.
7290681,"Uair a bhí mise ag fás suas, chonaic mé an buachaill is láidre sa mbaile. Agus ó chonaic mé an t-aonad san, nídh 'acainn dom dol im choladh.",7290684,"When I was growing up, I saw the largest boy in the village. Since I saw that unit, I have not been able to sleep."
7290664,Bhíos inniúil ar charr a chomáint.,7290685,I was able to drive a car.
7290694,Thá fhios ag Tom go ndéanann Máire an rud san uaireanta.,6528256,Tom knows that Mary sometimes does that.
7290698,Cuibheasach focainn maith an rud so.,1545928,This is fucking awesome.
7290700,Dh'aimsigh mé é ina luí ar an leaba.,283283,I found him lying on the bed.
7290702,Bhí liathróid sacair ag Saimí.,7237955,Sami had a soccer ball.
7290703,Bhí an dealramh dochtúra ar Tom go deimhin.,7127235,Tom really looked like a doctor.
6319622,Andreas is ainm dom.,7316651,Andreas is my name.
6319616,Is Francach mé.,340475,I am French.
6319621,Céard?,36088,What?
6319620,Múinim.,7316656,I teach.
6319626,Is bean aisteach í Maria.,7316657,Maria is a strange woman.
7590338,Níl mo choinsias glán.,7590353,My conscience is not clean.
7676166,An mise do chara?,2684430,Am I your friend?
7676167,Tháinig Liisa go han-luath.,2743924,Liisa came too early.
7676168,Is coimhthíoch é Tomás.,2272958,Tom is an outsider.
7676172,Ní dhéanfaidh mé dearmad ar a freagra riamh.,7675829,I will never forget her answer.
7676176,Rachaidh sé go dtí an fiaclóir.,7675191,He will go to the dentist.
7676186,Is gadaí an áthais í comparáid.,7673739,Comparison is the thief of joy.
7676194,Nach bhfuil sé sin go deas?,7673602,Isn't that cool?
7676201,Tá Máire go han-álainn.,7673590,Mary is extremely pretty.
7676205,Tá Judy cineálta le gach duine.,53024,Judy is kind to everyone.
7676210,An gcuimhníonn tú gach rud?,7672584,Do you remember everything?
7676213,An cuimhin leat gach rud?,7672584,Do you remember everything?
7676216,Tá gach duine ansin.,7672578,Everybody is there.
7676224,Tá grá againn ar an gcailín céanna.,7672503,We love the same girl.
7676230,Rugadh muid sa bhliain céanna.,7672500,We were born in the same year.
7676233,Seo é focal.,7672429,This is a word.
7676234,Is focal é seo.,7672429,This is a word.
7705877,Déanaim é mar is maith liom é a dhéanamh.,1736678,I do it because I like to do it.
7746142,D'ith an fear an t-arán.,890444,The man ate the bread.
7799800,Imithe ag iascaireacht.,7799801,Gone fishing.
7799803,Ghlac sé leis mar ionaí pearsanta an uair seo.,7799804,He took it as a personal attack this time.
7799811,Bain as mo phóca é go tapa!,7799812,Take it out of my pocket quickly!
7799813,Déan é as do neart féin.,7799815,Do it out of your own strength.
7801177,Tabhair dom d'ainm agus sloinne anois.,7801179,Give me your name and surname now.
7801184,Ghnóthaigh sí aird idirnáisiúnta as a cuid taighde.,7801187,She received international acclaim for her research.
7801195,"Tá go leor ann do thosaitheoirí ansin, go cinnte.",7801197,"There's enough for beginners there, certainly."
7801203,Tá mé ábalta é sin a dhéanamh anois.,7801206,I am able to do that now.
7801210,Las é suas.,2635889,Light it up.
7801213,Foghlaim cód.,7801216,Learn to code.
7801339,Ceart go leor.,1391646,Okay.
7801342,Feic!,1804273,Look!
7801343,Go soiléir!,2093425,Clearly!
7801344,Freagair!,2275597,Answer!
6319614,Haigh!,2742244,Hi!
7801348,Díol!,6046860,Sell!
7801349,Foc.,6099176,Fuck.
7801350,Abair.,6102406,Talk.
7801351,Abair!,6102407,Talk!
7801354,Hé!,7531989,Hey!
7801360,Abair arís?,24989,Come again?
5585530,Cad chuige?,24867,What for?
4616522,Cén fáth?,24862,For what?
7801362,Éist go cúramach,29922,Listen carefully.
7801363,Triail arís.,31723,Try again.
7801367,Rith Máire.,31907,Mary ran.
7801368,Chomh iontach!,36125,How wonderful!
7801371,Cé mhéid?,37616,How big?
7801372,Tar anseo.,39944,Come here.
7801373,Amach leat anois.,52067,Leave now.
7801382,Ritheann mé.,259190,I run.
7801345,Amach!,266790,Get out!
7801387,Fásann fásáin.,268563,Plants grow.
7801388,"Á, iontach.",273928,"Ah, wonderful."
7801390,Cé i bhfíos?,276369,Who knows?
7801395,Dúisigh!,323780,Wake up!
7801397,"Tosaigh, damnú!",328825,"Start, dammit!"
7801398,Tar isteach.,348091,Come in.
7801399,Buíochas le Dia.,370585,Thank God.
7801401,Tar abhaile.,413767,Come home.
7801402,Ádh mór!,429220,Good luck!
7801403,Tuigeann mé.,433468,I understand.
7801405,Gabh mo leithscéal.,433504,Excuse me.
7801419,Ach cén fáth?,457594,But why?
5599841,Maith thú!,464478,Well done!
7801437,I ndáiríre? Cad chuige?,505876,Really? Why?
7801438,Agus tusa?,524168,And you?
7801439,Gan stró.,551442,No prob.
7801440,"Á, ceart go leor!",623728,"Ah, okay!"
7801441,Aontaíonn muid.,628230,We agree.
7801443,Abair é.,773241,Say it.
7801448,Fan go socair.,788304,Stay calm.
7801449,Gan dabht.,809739,No doubt.
7801450,Dia daoibh!,854117,Hello everyone!
7801466,"A pháistí, éistígí!",908231,"Kids, listen!"
7801471,Bainne? Siúcra?,997029,Milk? Sugar?
7801474,Tchíonn muid.,1031255,We see.
7801476,Feiceann muid.,1031255,We see.
7801509,Tá mé.,1102982,I am.
7801510,Itheann mé.,1120797,I eat.
7801513,Mise fosta.,1124471,Me too.
7801518,Tusa arís?,1152126,You again?
7801466,"A pháistí, éistígí!",1192984,"Children, listen!"
7801522,"Anois, éist!",1184640,"Now, listen!"
7801551,Bí ciúin.,1275396,Be quiet.
7801555,Gúna deas.,1326299,Nice dress.
7801556,Chomh maith.,1349009,As well.
7801557,Abair amach!,1349055,Speak out!
7801559,Agus mar sin?,1349196,And so?
7801560,Fan anseo!,1349187,Stay here!
7801405,Gabh mo leithscéal.,1349974,Forgive me.
7801567,Bí dána!,1395974,Be bold!
7801572,An bhfuil aon duine abhaile?,1452758,Anybody home?
7801573,"Hé, tusa!",1493522,"Hey, you!"
7801577,"Abair, le do thoil.",1497506,"Speak, please."
2771723,Tá eagla ort.,7801506,You are scared.
7801587,Bhí muid le do mháthair.,7801463,We were with your mother.
7801590,Céard a déarfadh muid chun báis?,7801186,What do we say to death?
7801593,Tá tú ag faire.,7800948,You're watching.
7801595,Níl a fhios aige.,7800746,He has no clue.
5015864,Tá mé tinn.,7801526,I am ill.
7801909,an bhfuarthas?,455353,Got it?
7801910,Dia daoibh.,499391,"Hi, everyone."
7801911,Tráthnona maith.,499689,Good afternoon.
7801912,Ó! I ndáiríre?,515907,Oh! Really?
7801913,Culaith deas.,576038,Nice suit.
7801914,Ritheann tú.,672252,You run.
7801917,An fhírinne?,838654,The truth?
7801339,Ceart go leor.,879120,Okey doke.
7801920,An bhfuil siad?,1102965,They are?
7801921,Éirigh as!,1116867,Give up!
7801922,Turas fada?,1152120,Long journey?
7801924,I ndáiríre.,1216012,In fact.
7801925,Fás suas!,1218773,Grow up!
7801926,Obair mhaith!,1230517,Good work!
7801927,Ó! Iontach!,1098757,Oh! Marvelous!
7801928,Ith torthaí!,1388916,Eat fruits!
7801926,Obair mhaith!,1021038,Good job!
7801933,cá fhad ó?,1469822,Since when?
7801937,Labhraíonn tú.,938139,You speak.
7801940,Chomh tarraingteacht!,1060030,How fascinating!
7801941,"A Thomáis! ""A Mháire!""",1076717,“Tom!” “Mary!”
6319326,Is tusa ár ndóchas amháin.,1122908,You're our only hope.
7816171,Ní híocann coireacht.,282784,Crime doesn't pay.
7816199,Uaireanta cluinineann mé m'athair ag canadh san seomra folctha.,255204,I sometimes hear my father singing in the bathroom.
7816203,Déanfaidh mé aon rud ach an post sin.,47575,I'll do anything but that job.
7816213,D'imrínn le cúpla buachaillí.,63668,I used to play with a couple of boys.
7816255,Tá Meg ag bualadh druma.,31814,Meg is beating a drum.
7816264,Shéan an ambasáid tearmann polaitiúil do na dídeanaithe eachtracha.,275706,The embassy denied political asylum to foreign refugees.
871739,Céard a ólfaidh tú?,2644214,What'll you have to drink?
7869713,Dúirt Mary gur chabhraigh Tom leí.,6427077,Mary said that Tom helped her.
2974597,Fuair mé an t-airgead.,7869742,I got the money.
5168025,Tá aithne agam air.,71751,I know him.
748601,Sea.,7869799,It is.
6319588,"Lorg an focal seo san fhoclóir, le do thoil.",57959,Please look up this word in a dictionary.
6319588,"Lorg an focal seo san fhoclóir, le do thoil.",7869809,Please look up this word in the dictionary.
6319588,"Lorg an focal seo san fhoclóir, le do thoil.",7869812,"Look this word up in the dictionary, please."
874856,Deirtear go mbíonn sé te anseo.,7869819,They say it does be hot here.
5228133,Chomhairligh an dochtúir é éirí as an ól.,7869828,The doctor advised him to give up the drink.
5228133,Chomhairligh an dochtúir é éirí as an ól.,7869829,The doctor advised him to give up drinking.
